{
  "schema_version": "1.2",
  "meta": {
    "title": "UX delivery v2 dryrun — bootstrap",
    "locale": "ja-JP"
  },
  "epic": {
    "title": "【UX v2 dryrun】Figma-first · design-system-owner · design_quality（2026-06-06）",
    "notes_markdown": "## 目的\n\n`ux-delivery` v2 の PM サブタスク分解・4 ロール（ux-designer / design-system-owner / ux-reviewer ×2）が Asana 上で `comment_task` → `complete_task` まで到達することを確認する。\n\n## profile\n\n`flagship`\n\n## 記録\n\n`docs/verification/ux-delivery-v2-dryrun.md`"
  },
  "subtasks": [
    {
      "title": "【1/1・UX】flagship 体験設計 dryrun",
      "department": "ux",
      "background": "ux-delivery v2 · profile: flagship。blocking UX 子。",
      "summary": "ux-pm が assign-plan.dryrun-v2.json でサブタスク分解。Figma stub + design_quality + DS + ux_spec。",
      "done_when": "design_quality_passed · ux_spec_passed · DeptWorkComplete.artifacts[] に Figma URL 含む。"
    }
  ]
}
