{
  "schema_version": "1.2",
  "meta": {
    "title": "全チーム dryrun — 本番 Handoff",
    "locale": "ja-JP"
  },
  "epic": {
    "title": "【agent-create-supporter】全チーム・全メンバー dryrun（2026-05-23）",
    "notes_markdown": "## 解決ストーリー\n\n1. **企画** — Handoff sync\n2. **UX** — ux-pm サブタスク分解 → ux-designer / design-system-owner / ux-reviewer（v2）\n3. **分析** — analytics-pm サブタスク → 全分析ワーカー（analytics-requirements-writer 含む）\n4. **開発** — product-manager サブタスク（full-ui）→ 全開発ワーカー + ux-reviewer · UX ## 依存 転記\n\n## 検証\n\n各 slug が `fetch_task --show-assignee` 確認後に comment + complete。"
  },
  "subtasks": [
    {
      "title": "【1/4・企画】Handoff 作成・レビュー・Asana sync",
      "department": "planning",
      "background": "bootstrap 企画子に fuzzy マッチ。",
      "summary": "本 Handoff + PlanReviewResult を planning-pm 経由で sync。",
      "done_when": "execution 系子（UX・分析・開発）が親下に存在する。"
    },
    {
      "title": "【2/4・UX】体験設計 dryrun",
      "department": "ux",
      "background": "development full-ui の blocking 前提。",
      "summary": "ux-delivery v2（flagship）。ux-pm が dryrun-v2 plan で ux-designer / design-system-owner / ux-reviewer を分解。",
      "done_when": "design_quality_passed · ux_spec_passed · DeptWorkComplete.artifacts[]（Figma URL 含む）。"
    },
    {
      "title": "【3/4・分析】全ロール dryrun",
      "department": "analysis",
      "background": "分析チーム全 enabled ワーカーの comment 到達確認。",
      "summary": "analysis-delivery v2。analytics-pm が assign-plan.dryrun-v2 で分解（analytics-requirements-writer 含む）。",
      "done_when": "全サブ complete · analytics-pm が DeptWorkComplete。"
    },
    {
      "title": "【4/4・開発】full-ui dryrun",
      "department": "development",
      "background": "【2/4・UX】完了後。profile=full-ui。",
      "summary": "product-manager が assign-plan.full-ui-v1 でフェーズ分解。全開発ロール + ux-reviewer（ux_implementation）。",
      "done_when": "全サブ complete · verification_passed 相当 · product-manager DeptWorkComplete。"
    }
  ]
}
